"file","likely_contents"
"./data/data_raw/1810020501-eng.csv","Statistics Canada New Housing Price Index with multiple geography blocks and monthly values."
"./data/data_raw/lookup.csv","Daily Bank of Canada overnight-rate target data."
"./data/data_raw/3410015601-eng.csv","CMHC housing starts file. The current local export contains the Canada aggregate only."
"./data/data_raw/IRCC_M_TRStudy_0005_E.xls","Original IRCC Excel extract for study permits."
"./data/data_raw/ODP-TR-Study-DLI_name_PT_Admin_type.csv","Tab-delimited IRCC DLI extract by admin type."
"./data/data_raw/ODP-TR-Study-DLI_name_PT_Inst_type.csv","Tab-delimited IRCC DLI extract by institution type."
"./data/data_raw/student_permits_city_proxy_2015_2025_monthly.csv","Prebuilt monthly city study-permit proxy."
"./data/data_raw/study permits.csv","Institution-level monthly study permit counts in CSV form."
